{
  "authority_statement": "Informational report only; the deterministic LFighter pipeline retains all security decision authority.",
  "executive_summary": "This report presents the locked measurements, interpretations, and limitations for one frozen LFighter development and validation case. The report is informational, and all security decisions remain with the deterministic pipeline.",
  "facts": [
    {
      "evidence_refs": [
        "src:task45_condition"
      ],
      "statement": "The plain attack mean DDoS to Benign prediction rate was 0.329128 versus 0.040246 in the paired clean branch."
    },
    {
      "evidence_refs": [
        "src:task45_condition"
      ],
      "statement": "Mean malicious recall was 0.975000; minimum malicious recall was 0.900000; maximum benign false positive rate was 0.000000."
    },
    {
      "evidence_refs": [
        "src:task57_triplets"
      ],
      "statement": "Normalized attribution distance decreased from 0.753257 to 0.467583, with recovery fraction 0.379252."
    },
    {
      "evidence_refs": [
        "src:task45_condition"
      ],
      "statement": "The defended mean DDoS to Benign prediction rate was 0.042709, an absolute reduction of 0.286420 from the plain attack branch."
    }
  ],
  "interpretations": [
    {
      "confidence": "moderate",
      "evidence_refs": [
        "src:task45_condition",
        "src:task45_rounds"
      ],
      "statement": "The observed prediction behavior is consistent with targeted suppression of DDoS predictions toward the Benign class, but it does not establish malicious intent."
    },
    {
      "confidence": "high",
      "evidence_refs": [
        "src:task57_triplets",
        "src:task57_decision"
      ],
      "statement": "Reconstruction moved the attribution profile toward its paired preattack clean reference; this is not evidence of oracle clean restoration."
    }
  ],
  "record_id": "lfighter:task61:seed2026:C_hash_ranked:size10",
  "refusals": [
    "Not supported by this evidence: Verified malicious intent.",
    "Not supported by this evidence: Exact oracle clean recovery.",
    "Not supported by this evidence: Generalization to unseen organizations or physical clients.",
    "Not supported by this evidence: Authority for an LLM to change any defense decision."
  ],
  "report_title": "LFighter grounded forensic evidence report",
  "schema_version": "1.0.0",
  "uncertainties": [
    "The clean attribution comparator is the paired round 4 preattack reference rather than an oracle clean state.",
    "Rejected and oracle clean attribution states were unavailable and were not substituted.",
    "Per client detector scores and numeric threshold values were not present in the selected summary artifacts.",
    "The evidence is development and validation evidence; reserved test arrays remained closed."
  ]
}
