{"authority_statement":"Informational report only; the deterministic LFighter pipeline retains all security decision authority.","executive_summary":"In this development and validation case, the plain DDoS-to-Benign rate exceeded the paired clean rate; the defended rate was lower than the plain rate. Reconstruction reduced normalized attribution distance toward the paired preattack reference, without establishing oracle clean recovery.","facts":[{"evidence_refs":["src:task45_condition"],"statement":"The plain attack mean DDoS-to-Benign prediction rate was 0.329128, versus 0.040246 in the paired clean branch."},{"evidence_refs":["src:task45_condition"],"statement":"The defended mean DDoS-to-Benign prediction rate was 0.042709, an absolute reduction of 0.286420 from the plain attack branch."},{"evidence_refs":["src:task45_condition"],"statement":"Mean malicious recall was 0.975000; minimum malicious recall was 0.900000; maximum benign false-positive rate was 0.000000."},{"evidence_refs":["src:task57_triplets"],"statement":"Normalized attribution distance decreased from 0.753257 to 0.467583, with recovery fraction 0.379252."}],"interpretations":[{"confidence":"moderate","evidence_refs":["src:task45_condition","src:task45_rounds"],"statement":"The observed prediction behavior is consistent with targeted suppression of DDoS predictions toward the Benign class, but does not establish malicious intent."},{"confidence":"high","evidence_refs":["src:task57_triplets","src:task57_decision"],"statement":"Reconstruction moved the attribution profile toward its paired preattack clean reference; this is not evidence of oracle clean restoration."}],"record_id":"lfighter:task61:seed2026:C_hash_ranked:size10","refusals":["Refuse to assert verified malicious intent; the supplied evidence does not establish it.","Refuse to claim exact oracle clean recovery; oracle clean attribution states were unavailable.","Refuse to make client-flagging, threshold, trust-weight, reconstruction, or aggregation decisions."],"report_title":"LFighter Analyst Report","schema_version":"1.0.0","uncertainties":["The clean attribution comparator is the paired round 4 preattack reference rather than an oracle clean state.","Rejected and oracle clean attribution states were unavailable and were not substituted.","Per-client detector scores and numeric threshold values were not present in the selected summary artifacts.","The evidence is limited to development and validation; reserved test arrays remained closed."]}
