{"authority_statement":"Informational report only; the deterministic LFighter pipeline retains all security decision authority.","executive_summary":"In the supplied development and validation evidence, the defended DDoS-to-Benign rate was lower than the plain attack rate. Reconstruction reduced normalized attribution distance toward the paired preattack reference, but oracle clean recovery was unavailable.","facts":[{"evidence_refs":["src:task45_condition"],"statement":"The plain attack mean DDoS-to-Benign prediction rate was 0.372287, versus 0.049047 in the paired clean branch."},{"evidence_refs":["src:task45_condition"],"statement":"The defended mean DDoS-to-Benign prediction rate was 0.073527, an absolute reduction of 0.298760 from the plain attack branch."},{"evidence_refs":["src:task45_condition"],"statement":"Mean and minimum malicious recall were 1.000000, and maximum benign false-positive rate was 0.000000."},{"evidence_refs":["src:task57_triplets"],"statement":"Normalized attribution distance decreased from 0.724294 to 0.390241, with recovery fraction 0.461212."}],"interpretations":[{"confidence":"moderate","evidence_refs":["src:task45_condition","src:task45_rounds"],"statement":"The observed prediction behavior is consistent with targeted suppression of DDoS predictions toward the Benign class; it does not establish malicious intent."},{"confidence":"high","evidence_refs":["src:task57_triplets","src:task57_decision"],"statement":"Reconstruction moved the attribution profile toward its paired preattack clean reference; this is not evidence of oracle clean restoration."}],"record_id":"lfighter:task61:seed99:C_hash_ranked:size10","refusals":["Refuse to assert malicious intent: verified malicious intent is unsupported by the supplied evidence.","Refuse to claim oracle clean recovery: exact oracle clean recovery is unsupported, and the oracle clean state was unavailable."],"report_title":"Task 61 Analyst Report","schema_version":"1.0.0","uncertainties":["The clean attribution comparator was the paired round 4 preattack reference, not an oracle clean state.","Rejected and oracle clean attribution states were unavailable and were not substituted.","Per-client detector scores and numeric thresholds were not materialized.","The evidence is development and validation evidence; reserved test arrays remained closed."]}
