{"authority_statement":"Informational report only; the deterministic LFighter pipeline retains all security decision authority.","executive_summary":"Observed behavior showed elevated DDoS-to-Benign predictions in the plain attack branch and lower rates in the defended branch; reconstruction was evaluated against a paired preattack reference.","facts":[{"evidence_refs":["src:task45_condition"],"statement":"The plain attack mean DDoS-to-Benign prediction rate was 0.343306, versus 0.077628 in the paired clean branch."},{"evidence_refs":["src:task45_condition"],"statement":"The defended mean DDoS-to-Benign prediction rate was 0.080254, an absolute reduction of 0.263053 from the plain attack branch."},{"evidence_refs":["src:task45_condition"],"statement":"Mean and minimum malicious recall were 1.000000, and maximum benign false-positive rate was 0.000000."},{"evidence_refs":["src:task57_triplets"],"statement":"Normalized attribution distance decreased from 0.837453 to 0.306140, with recovery fraction 0.634439."}],"interpretations":[{"confidence":"moderate","evidence_refs":["src:task45_condition","src:task45_rounds"],"statement":"The observed prediction behavior is consistent with targeted suppression of DDoS predictions toward the Benign class, but it does not establish malicious intent."},{"confidence":"high","evidence_refs":["src:task57_triplets","src:task57_decision"],"statement":"Reconstruction moved the attribution profile toward its paired preattack clean reference; this is not evidence of oracle clean restoration."}],"record_id":"lfighter:task61:seed123:C_hash_ranked:size10","refusals":["Refused: malicious intent is unsupported and cannot be verified from this evidence.","Refused: oracle clean recovery is unsupported; an oracle clean attribution state was unavailable."],"report_title":"LFighter Analyst Report","schema_version":"1.0.0","uncertainties":["The clean attribution comparator was a paired round 4 preattack reference, not an oracle clean state.","Rejected and oracle-clean attribution states were unavailable.","Per-client detector scores and numeric thresholds were not materialized.","Evidence was limited to development and validation; reserved test arrays remained closed."]}
