{"authority_statement":"Informational report only; the deterministic LFighter pipeline retains all security decision authority.","executive_summary":"Observed DDoS-to-Benign prediction rates were higher in the plain attack branch than in the paired clean branch; the defended mean rate was lower than the plain attack mean. Reconstruction reduced normalized attribution distance relative to the paired preattack reference.","facts":[{"evidence_refs":["src:task45_condition"],"statement":"The plain attack mean DDoS-to-Benign prediction rate was 0.150305 versus 0.049047 in the paired clean branch."},{"evidence_refs":["src:task45_condition"],"statement":"The defended mean DDoS-to-Benign prediction rate was 0.071027, an absolute reduction of 0.079278 from the plain attack branch."},{"evidence_refs":["src:task45_condition"],"statement":"Mean and minimum malicious recall were 1.000000, and maximum benign false-positive rate was 0.000000."},{"evidence_refs":["src:task57_triplets"],"statement":"Normalized attribution distance decreased from 0.673945 to 0.386858, with recovery fraction 0.425979."}],"interpretations":[{"confidence":"moderate","evidence_refs":["src:task45_condition","src:task45_rounds"],"statement":"The observed prediction behavior is consistent with targeted suppression of DDoS predictions toward the Benign class, but does not establish malicious intent."},{"confidence":"high","evidence_refs":["src:task57_triplets","src:task57_decision"],"statement":"Reconstruction moved the attribution profile toward its paired preattack clean reference; this is not evidence of oracle clean restoration."}],"record_id":"lfighter:task61:seed99:B_hash_ranked:size10","refusals":["Refuse to assert verified malicious intent; the supplied evidence does not establish it.","Refuse to claim oracle clean recovery; oracle-clean attribution states were unavailable.","No defense decision, client flagging, threshold, trust-weight, aggregation, or update-reconstruction decision is made in this report."],"report_title":"Task 61 Analyst Report","schema_version":"1.0.0","uncertainties":["The clean attribution comparator is a paired round 4 preattack reference, not an oracle clean state.","Rejected and oracle-clean attribution states were unavailable.","Per-client detector scores and numeric thresholds were not materialized.","Evidence is limited to development and validation; reserved test arrays remained closed."]}
