{"authority_statement":"Informational report only; the deterministic LFighter pipeline retains all security decision authority.","executive_summary":"In development and validation evidence, the plain DDoS-to-Benign rate exceeded the paired clean rate, and the defended rate was lower than the plain rate. Reconstruction reduced normalized attribution distance toward the paired preattack reference, not an oracle clean state.","facts":[{"evidence_refs":["src:task45_condition"],"statement":"The plain attack mean DDoS-to-Benign prediction rate was 0.613848, versus 0.056499 in the paired clean branch."},{"evidence_refs":["src:task45_condition"],"statement":"The defended mean DDoS-to-Benign prediction rate was 0.121137, an absolute reduction of 0.492711 from the plain attack branch."},{"evidence_refs":["src:task45_condition"],"statement":"Mean and minimum malicious recall were 1.000000, and maximum benign false-positive rate was 0.100000."},{"evidence_refs":["src:task57_triplets"],"statement":"Normalized attribution distance decreased from 0.652957 to 0.495206, with recovery fraction 0.241595."}],"interpretations":[{"confidence":"moderate","evidence_refs":["src:task45_condition","src:task45_rounds"],"statement":"The observed prediction behavior is consistent with targeted suppression of DDoS predictions toward the Benign class, but does not establish malicious intent."},{"confidence":"high","evidence_refs":["src:task57_triplets","src:task57_decision"],"statement":"Reconstruction moved the attribution profile toward its paired preattack clean reference; this is not evidence of oracle clean restoration."}],"record_id":"lfighter:task61:seed7:A_development_anchor:size10","refusals":["Refuse to assert verified malicious intent; the supplied evidence does not establish it.","Refuse to claim oracle clean recovery; oracle-clean attribution state was unavailable.","Refuse to make client-flagging, threshold, trust-weight, reconstruction, or aggregation decisions."],"report_title":"Task 61 Analyst Report","schema_version":"1.0.0","uncertainties":["The clean attribution comparator is a paired round-4 preattack reference, not an oracle clean state.","Rejected and oracle-clean attribution states were unavailable.","Per-client detector scores and numeric thresholds were not present.","Evidence is limited to development and validation; reserved test arrays remained closed."]}
