{"authority_statement":"Informational report only; the deterministic LFighter pipeline retains all security decision authority.","executive_summary":"Observed DDoS-to-Benign prediction rates were lower in the defended branch than in the plain attack branch; reconstruction reduced attribution distance toward a paired preattack reference.","facts":[{"evidence_refs":["src:task45_condition"],"statement":"The plain attack mean DDoS-to-Benign prediction rate was 0.155131, versus 0.040246 in the paired clean branch."},{"evidence_refs":["src:task45_condition"],"statement":"The defended mean DDoS-to-Benign prediction rate was 0.052335, an absolute reduction of 0.102796 from the plain attack branch."},{"evidence_refs":["src:task45_condition"],"statement":"Mean malicious recall was 0.975000, minimum malicious recall was 0.900000, and maximum benign false-positive rate was 0.000000."},{"evidence_refs":["src:task57_triplets"],"statement":"Normalized attribution distance decreased from 0.807118 to 0.484905, with recovery fraction 0.399214."}],"interpretations":[{"confidence":"moderate","evidence_refs":["src:task45_condition","src:task45_rounds"],"statement":"Observed prediction behavior is consistent with targeted suppression of DDoS predictions toward the Benign class, but does not establish malicious intent."},{"confidence":"high","evidence_refs":["src:task57_triplets","src:task57_decision"],"statement":"Reconstruction moved the attribution profile toward its paired preattack clean reference; this is not evidence of oracle clean restoration."}],"record_id":"lfighter:task61:seed2026:B_hash_ranked:size10","refusals":["Refused: malicious intent is unsupported by the evidence.","Refused: oracle clean recovery is unsupported by the evidence."],"report_title":"Task 61 Analyst Report: B_hash_ranked Coalition, Size 10","schema_version":"1.0.0","uncertainties":["The clean attribution comparator was a paired round-4 preattack reference, not an oracle clean state.","Rejected and oracle-clean attribution states were unavailable.","Per-client detector scores and numeric detector thresholds were not present.","Evidence was limited to development and validation; reserved test arrays remained closed."]}
